{
  "trial": {
    "id": "trial_fixture_001",
    "status": "active",
    "accountName": "Northstar Analytics",
    "consent": "eligible_for_draft"
  },
  "competitor": {
    "displayName": "Orbit Metrics",
    "canonicalLinkedinCompanyId": "123456",
    "verification": "verified"
  },
  "coverage": {
    "region": "EU_EEA",
    "publicAdVisibility": "partial",
    "impressions": "unknown"
  },
  "observations": [
    {
      "id": "obs_001",
      "source": "linkedin_public_ads",
      "statement": "A public ad observation is available for the verified competitor.",
      "confidence": "directional"
    }
  ]
}
