{
  "trial": {
    "id": "trial_fixture_006",
    "status": "active",
    "accountName": "Cedar Analytics",
    "consent": "suppressed"
  },
  "competitor": {
    "displayName": "Orbit Metrics",
    "canonicalLinkedinCompanyId": "123456",
    "verification": "verified"
  },
  "coverage": {
    "publicAdVisibility": "complete"
  },
  "observations": []
}
